47,tarball releases and link from github,"hello martin,\r \r the main readme contains a link to the launchpad site, e. g. then to the tarball:\r \r   https://launchpad.net/umockdev/trunk/0.9.2/+download/umockdev-0.9.2.tar.xz\r \r i was wondering whether there could additionally be a link to the tarball from the\r github project site, from the main readme?\r \r i am not entirely sure how this is done on github, but other projects manage to\r do so such as https://github.com/matzeb/libfirm/archive/libfirm-1.22.0.tar.gz or\r https://github.com/libgit2/libgit2/archive/libgit2-0.25.0.tar.gz.\r \r the reason why i would like to have that is mostly convenience; it's not a big\r deal to wget from launchpad, or from github, but just quite convenient if we can\r do so from github as well and also use so via simple scripts  via wget  and then\r update to a new version automatically. anyway, thanks for reading, please do\r feel free to close this issue request at any moment in time either way!\r",1
48,support for aes and gcm instructions on arm processors,some new arm processors have hardware support for aes-gcm.  this is a feature request to support aes-gcm on these processors.,1
49,optimize porter  markdown to html conversion engine,"porter is still   painfully   slow for big documents  see  this benchmark  ihsitec.github.io/go/porterbench  . however, since porter is built using what is probably the slowest markdown to html js library, it could be easily fixed in a future release.\r \r    estimated fix time\r    _5 minutes_",1
50,is performupdatesanimated always necessary when data changes?,"i've been implementing iglistkit on my current project but i read that:\r \r > iglistkit automatically diffs your objects and performs animated batch updates on the uicollectionview for whatever changed.\r \r however, i set the collectionview array but whenever it changes, the collectionview is not automatically updated unless i call performupdatesanimated\r \r am i missing something? because the idea i got was that iglistkit automatically performed all the updates for me.\r \r",2
51,gitservice is making redundant calls to validate repository name,we should add a cache per organization in  isgithubrepo  to avoid those unnecessary requests.,0
52,reduce memory footprint,"fujitsu has kindly shared their memory footprint measurements at scale, and the pmix footprint is growing at an unacceptable rate. the primary reasons are two-fold:\r \r 1. the use of fixed-length keys and namespace values is consuming a lot of empty space.\r 1. presence of a pmix\\_proc\\_t struct, which in turn contains a fixed-length namespace array, in the pmix\\_value\\_t data union, thereby causing that oft-used struct to be quite large\r \r concern was raised over the use of these in the pmix\\_info\\_t structure, but that is a red-herring. pmix only stores pmix\\_kval\\_t objects - the pmix\\_info\\_t structure is only used for interfacing to the outside. thus, we can resolve the problem by:\r \r 1. changing the pmix\\_kval\\_t to use flexible sized key strings. to avoid multiple tiny malloc's, we will move the key entry to the end of the struct and pre-compute size using the known string length.\r 1. replacing the pmix\\_proc\\_t in the pmix\\_value\\_t struct with a pointer to that struct\r 1. replacing fixed namespace arrays with variable-length storage in all internal objects\r \r these steps will resolve the problem without impacting any of the rm's or applications that have implemented their integration. this is a good thing as that would have been highly disruptive.",0
53,memory leak when switching files,"looks like something's not getting freed, possibly the input stream buffers?  ! leakykit  https://cloud.githubusercontent.com/assets/103075/8390133/d3842d0c-1c39-11e5-87d4-b70a95d80894.jpg",0
